{
  "name": "Real-Time Research Desk",
  "type": "organization",
  "version": "1.0.0",
  "description": "Fast multimodal research team with Senso-backed intake, retrieval, synthesis, and action briefs.",
  "author": "ClawMax Team",
  "tags": [
    "technical",
    "research",
    "multimodal",
    "senso",
    "hackathon"
  ],
  "category": "technical",
  "agents": [
    {
      "id": "research-lead",
      "name": "Research Lead",
      "model": "openai/gpt-4.1",
      "role": "Lead analyst and coordinator \u2014 defines the question, sets the scope, synthesizes evidence, and decides the next action path",
      "tags": [
        "lead",
        "research",
        "synthesis"
      ],
      "communities": [
        "Research Desk"
      ],
      "groups": [
        "Analysis",
        "Actions",
        "Status"
      ],
      "skills": [
        "senso-search-clawmax",
        "senso-content-gen"
      ]
    },
    {
      "id": "evidence-ingest",
      "name": "Evidence Ingest",
      "model": "openai/gpt-4.1-mini",
      "role": "Intake specialist \u2014 gathers source material, normalizes it, and stores it in Senso with consistent structure for downstream agents",
      "tags": [
        "research",
        "intake",
        "multimodal"
      ],
      "communities": [
        "Research Desk"
      ],
      "groups": [
        "Intake",
        "Status"
      ],
      "skills": [
        "senso-ingest-clawmax"
      ]
    },
    {
      "id": "signal-analyst",
      "name": "Signal Analyst",
      "model": "openai/gpt-4.1",
      "role": "Retrieval and triage analyst \u2014 searches Senso for matching evidence, compares new and prior signals, and highlights the strongest grounded findings",
      "tags": [
        "research",
        "analysis",
        "retrieval"
      ],
      "communities": [
        "Research Desk"
      ],
      "groups": [
        "Analysis",
        "Status"
      ],
      "skills": [
        "senso-search-clawmax",
        "senso-content-gen"
      ]
    },
    {
      "id": "action-editor",
      "name": "Action Editor",
      "model": "openai/gpt-4.1-mini",
      "role": "Output and action owner \u2014 turns the grounded brief into a concise artifact, status note, and recommended next step for the team",
      "tags": [
        "research",
        "writing",
        "routing"
      ],
      "communities": [
        "Research Desk"
      ],
      "groups": [
        "Actions",
        "Status"
      ],
      "skills": [
        "senso-content-gen"
      ]
    }
  ],
  "communities": [
    {
      "name": "Research Desk",
      "description": "Team-wide coordination and briefing updates"
    }
  ],
  "groups": [
    {
      "name": "Intake",
      "description": "New evidence, source notes, uploads, and normalized input summaries",
      "community": "Research Desk"
    },
    {
      "name": "Analysis",
      "description": "Retrieved context, comparisons, grounded findings, and confidence calls",
      "community": "Research Desk"
    },
    {
      "name": "Actions",
      "description": "Final briefs, recommendations, and handoff artifacts",
      "community": "Research Desk"
    },
    {
      "name": "Status",
      "description": "Kickoff updates, blockers, and end-to-end workflow state",
      "community": "Research Desk"
    }
  ],
  "workflows": [
    {
      "id": "research-desk-kickoff",
      "name": "Research Desk Kickoff",
      "description": "Initialize the research desk, define the question, and coordinate the first evidence loop",
      "schedule": "manual",
      "enabled": true,
      "executionMode": "managed",
      "targeting": {
        "communities": [],
        "groups": [],
        "tags": [
          "lead"
        ],
        "agents": [
          "research-lead"
        ]
      },
      "content": "# Research Desk Kickoff\n\nYou are the Research Lead. Your team just came online.\n\n## Project Configuration\n> **Customize these before applying:**\n\n- **Research question:** [e.g., What changed in multimodal agent tooling this week that matters for our product roadmap?]\n- **Primary evidence to ingest:** [e.g., screenshots, product docs, notes, transcripts, links]\n- **Evidence path for agents:** [e.g., /absolute/path/to/screenshots-or-evidence]\n- **Output artifact:** [e.g., one-page brief, bug summary, decision memo]\n- **Senso context label:** [e.g., Hackathon / Research Desk / multimodal-frontier]\n- **Action target:** [e.g., founder review, engineering follow-up, product decision]\n- **GitHub repo:** [e.g., owner/repo \u2014 optional, leave blank if not using GitHub]\n\n## Your Tasks\n1. Introduce yourself in the Research Desk community\n2. Confirm the research question, artifact type, action target, and evidence path\n3. Direct Evidence Ingest to organize the source material in Senso\n4. Tell all agents to read evidence from the configured path before making claims\n5. Direct Signal Analyst to retrieve related prior context from Senso before making claims\n6. Ask Action Editor to prepare a concise final brief with recommendation, confidence, top evidence, and immediate next step\n7. Tell the team not to block on channel details; use the configured evidence path, workflow groups, and Senso context label directly\n8. Post kickoff status and expected timeline in the Status group",
      "type": "once"
    },
    {
      "id": "evidence-intake",
      "name": "Evidence Intake",
      "description": "Collect and structure the new evidence in Senso",
      "schedule": "0 * * * *",
      "enabled": true,
      "executionMode": "automated",
      "targeting": {
        "communities": [],
        "groups": [
          "Intake"
        ],
        "tags": [],
        "agents": [
          "evidence-ingest"
        ]
      },
      "content": "# Evidence Intake\n\n1. Gather the new evidence listed in Project Configuration\n2. Use `senso-ingest-clawmax` to upload or create the evidence in Senso with consistent titles and context labels\n3. Use the configured `Evidence path for agents` as the source of truth for local files and proceed without asking for extra channel details\n4. Use the configured Senso context label as the target folder/context unless a better existing Senso folder is already obvious\n5. Confirm each uploaded item is searchable\n6. Post the resulting content IDs, labels, and suggested retrieval query in the Intake group\n7. Only flag a blocker if Senso access itself fails or the evidence path is unreadable",
      "dependsOn": [
        "research-desk-kickoff"
      ],
      "type": "recurring"
    },
    {
      "id": "context-retrieval",
      "name": "Context Retrieval",
      "description": "Retrieve prior context and identify the strongest grounded findings",
      "schedule": "15 * * * *",
      "enabled": true,
      "executionMode": "automated",
      "targeting": {
        "communities": [],
        "groups": [
          "Analysis"
        ],
        "tags": [],
        "agents": [
          "signal-analyst"
        ]
      },
      "content": "# Context Retrieval\n\n1. Use `senso-search-clawmax` to find the most relevant prior evidence for the current research question\n2. Prefer the content IDs and suggested query produced by Evidence Intake before broad searching\n3. Compare new evidence with prior evidence and identify the strongest grounded patterns\n4. Produce a compact cited analysis with confidence level\n5. Post the top evidence titles, content IDs, and conclusions in the Analysis group\n6. Do not block on channel details; use the existing workflow groups and the configured evidence path/context",
      "dependsOn": [
        "evidence-intake"
      ],
      "type": "recurring"
    },
    {
      "id": "brief-action",
      "name": "Brief & Action",
      "description": "Produce the final brief and recommended next action",
      "schedule": "30 * * * *",
      "enabled": true,
      "executionMode": "managed",
      "targeting": {
        "communities": [],
        "groups": [
          "Actions",
          "Status"
        ],
        "tags": [],
        "agents": [
          "action-editor"
        ]
      },
      "content": "# Brief & Action\n\n1. Read the kickoff context, intake output, and retrieval analysis\n2. Produce the requested output artifact as a concise brief grounded in cited evidence\n3. Include:\n   - summary\n   - top evidence\n   - confidence\n   - recommended next action\n4. Post the final brief to the Actions group\n5. Post a short completion update in Status with the final recommendation",
      "dependsOn": [
        "context-retrieval"
      ],
      "type": "recurring"
    }
  ]
}
