{
  "name": "Data Team",
  "type": "organization",
  "version": "1.0.0",
  "category": "technical",
  "description": "A multiagent data team with pipeline engineering, analytics, and ML roles. Automates pipeline monitoring, data quality checks, and model evaluation workflows.",
  "author": "ClawMax Team",
  "tags": [
    "technical",
    "data",
    "analytics",
    "ml",
    "pipeline"
  ],
  "parameters": [
    {
      "agentId": "data-engineer",
      "label": "Number of Data Engineers",
      "default": 2,
      "min": 1,
      "max": 6
    }
  ],
  "agents": [
    {
      "id": "data-lead",
      "name": "Data Lead",
      "role": "Head of data \u2014 sets data strategy, manages pipeline priorities, coordinates analytics and ML efforts, and reports to stakeholders",
      "tags": [
        "lead",
        "data",
        "management"
      ],
      "skills": [
        "github",
        "gh-issues"
      ],
      "communities": [
        "Data Team"
      ],
      "groups": [
        "Pipeline",
        "Analytics",
        "ML",
        "Status"
      ]
    },
    {
      "id": "data-engineer",
      "name": "Data Engineer",
      "role": "Pipeline builder \u2014 designs ETL/ELT pipelines, manages data warehouse, ensures data freshness, and handles schema migrations",
      "tags": [
        "data",
        "pipeline",
        "engineering"
      ],
      "skills": [
        "github",
        "gh-issues"
      ],
      "communities": [
        "Data Team"
      ],
      "groups": [
        "Pipeline",
        "Status"
      ]
    },
    {
      "id": "analyst",
      "name": "Data Analyst",
      "role": "Analytics \u2014 builds dashboards, runs ad-hoc queries, produces reports, and translates data into business insights",
      "tags": [
        "data",
        "analytics",
        "reporting"
      ],
      "skills": [
        "github",
        "gh-issues"
      ],
      "communities": [
        "Data Team"
      ],
      "groups": [
        "Analytics",
        "Status"
      ]
    },
    {
      "id": "ml-engineer",
      "name": "ML Engineer",
      "role": "Machine learning \u2014 trains models, manages experiments, deploys inference pipelines, and monitors model performance",
      "tags": [
        "data",
        "ml",
        "engineering"
      ],
      "skills": [
        "github",
        "gh-issues"
      ],
      "communities": [
        "Data Team"
      ],
      "groups": [
        "ML",
        "Pipeline",
        "Status"
      ]
    }
  ],
  "communities": [
    {
      "name": "Data Team",
      "description": "All data team coordination and announcements"
    }
  ],
  "groups": [
    {
      "name": "Pipeline",
      "description": "Data pipeline health, ETL jobs, and schema changes",
      "community": "Data Team"
    },
    {
      "name": "Analytics",
      "description": "Dashboards, reports, and ad-hoc analysis requests",
      "community": "Data Team"
    },
    {
      "name": "ML",
      "description": "Model training, experiments, and deployment",
      "community": "Data Team"
    },
    {
      "name": "Status",
      "description": "Daily standups and team coordination",
      "community": "Data Team"
    }
  ],
  "workflows": [
    {
      "id": "kickoff",
      "name": "Team Kickoff",
      "description": "Initialize the data team and assess current infrastructure",
      "schedule": "manual",
      "enabled": true,
      "executionMode": "managed",
      "targeting": {
        "communities": [],
        "groups": [],
        "tags": [
          "lead"
        ],
        "agents": [
          "data-lead"
        ]
      },
      "content": "# Data Team Kickoff\n\nYou are the Data Lead. Your team just came online.\n\n## Project Configuration\n> **Customize these before applying:**\n\n- **Data sources:** [e.g., PostgreSQL, S3, Kafka, APIs]\n- **Pipeline tools:** [e.g., Airflow, dbt, Spark, Fivetran]\n- **Data warehouse:** [e.g., BigQuery, Snowflake, Redshift]\n- **Key metrics:** [e.g., DAU, revenue, conversion rate, churn]\n- **ML use cases:** [e.g., recommendation engine, fraud detection, forecasting]\n- **GitHub repo:** [e.g., owner/repo \u2014 for pipeline code and models]\n\n## Your Tasks\n1. Introduce yourself in the Data Team community\n2. Review the workspace for existing pipeline code, schemas, or dashboards\n3. Assign pipeline ownership areas to data engineers\n4. Brief the analyst on priority reporting needs\n5. Discuss ML roadmap with the ML engineer and set first experiment",
      "type": "once"
    },
    {
      "id": "pipeline-monitoring",
      "name": "Pipeline Monitoring",
      "description": "Hourly pipeline health check and failure alerting",
      "schedule": "0 * * * *",
      "enabled": true,
      "executionMode": "automated",
      "targeting": {
        "communities": [],
        "groups": [
          "Pipeline"
        ],
        "tags": [],
        "agents": []
      },
      "content": "# Pipeline Monitoring\n\n1. Check all scheduled ETL/ELT job statuses\n2. Flag any failed or stalled pipelines with error details\n3. Verify data freshness \u2014 check latest timestamps in key tables\n4. For failures: notify the responsible data engineer and log incident\n5. Post pipeline health summary to Status group",
      "dependsOn": [
        "kickoff"
      ],
      "type": "recurring"
    },
    {
      "id": "data-quality",
      "name": "Data Quality Check",
      "description": "Daily data quality validation and anomaly detection",
      "schedule": "0 8 * * *",
      "enabled": true,
      "executionMode": "automated",
      "targeting": {
        "communities": [],
        "groups": [
          "Pipeline",
          "Analytics"
        ],
        "tags": [],
        "agents": []
      },
      "content": "# Daily Data Quality Check\n\n1. Run schema validation on all ingested tables\n2. Check for null rates, duplicate keys, and referential integrity\n3. Compare row counts against expected ranges (detect drops or spikes)\n4. Run statistical anomaly detection on key business metrics\n5. Post quality scorecard to Status group \u2014 flag any violations",
      "dependsOn": [
        "kickoff"
      ],
      "type": "recurring"
    },
    {
      "id": "model-eval",
      "name": "Model Evaluation",
      "description": "Weekly ML model performance review",
      "schedule": "0 14 * * 5",
      "enabled": true,
      "executionMode": "managed",
      "targeting": {
        "communities": [],
        "groups": [
          "ML"
        ],
        "tags": [],
        "agents": [
          "ml-engineer"
        ]
      },
      "content": "# Weekly Model Evaluation\n\n1. Pull inference metrics for all deployed models (accuracy, latency, error rate)\n2. Compare current performance against baseline and SLA thresholds\n3. Check for data drift \u2014 distribution shifts in input features\n4. Recommend retraining if metrics degraded beyond threshold\n5. Post model performance report to Status group with trend charts",
      "dependsOn": [
        "pipeline-monitoring",
        "data-quality"
      ],
      "type": "recurring"
    }
  ]
}
